{"entries":[{"byteCount":10,"contentType":"application/vnd.fuminiwa.entity+json;version=2","entityKey":"work/attachment-order","objectId":"8f05bafd61f29998ca102b333f853628502d4e45d53cff41148d6dd15f011792"},{"byteCount":10,"contentType":"application/vnd.fuminiwa.entity+json;version=2","entityKey":"work/chapter-order","objectId":"8f05bafd61f29998ca102b333f853628502d4e45d53cff41148d6dd15f011792"},{"byteCount":10,"contentType":"application/vnd.fuminiwa.entity+json;version=2","entityKey":"work/character-order","objectId":"8f05bafd61f29998ca102b333f853628502d4e45d53cff41148d6dd15f011792"},{"byteCount":96,"contentType":"application/vnd.fuminiwa.entity+json;version=2","entityKey":"work/document","objectId":"1ada402c66c29866fb31c52ab76eccfe2c624eaea94e7a88074d9ebc191e1b5d"},{"byteCount":10,"contentType":"application/vnd.fuminiwa.entity+json;version=2","entityKey":"work/flag-order","objectId":"8f05bafd61f29998ca102b333f853628502d4e45d53cff41148d6dd15f011792"},{"byteCount":10,"contentType":"application/vnd.fuminiwa.entity+json;version=2","entityKey":"work/plot-card-order","objectId":"8f05bafd61f29998ca102b333f853628502d4e45d53cff41148d6dd15f011792"},{"byteCount":42,"contentType":"application/vnd.fuminiwa.entity+json;version=2","entityKey":"work/synopsis","objectId":"1b480863422b62bbe354c950dec8f130c2cc85072cb797f391a4806221fdd381"},{"byteCount":27,"contentType":"application/vnd.fuminiwa.entity+json;version=2","entityKey":"work/title","objectId":"16dc45cdbf32d3158bcd5e2c52ddafee992004fd8bdfb5f44900e684896a81f0"},{"byteCount":10,"contentType":"application/vnd.fuminiwa.entity+json;version=2","entityKey":"work/world-note-order","objectId":"8f05bafd61f29998ca102b333f853628502d4e45d53cff41148d6dd15f011792"}],"parentSnapshotIds":[],"schemaVersion":2,"workId":"00000000-0000-4000-8000-000000000002"}