{"entries":[{"byteCount":3,"contentType":"application/octet-stream","entityKey":"attachment/00000000-0000-4000-8000-000000000107/bytes","objectId":"60be9861750facbfad8758254a2f76c0cfe78d54459a3bc187d49b1401fcd8e8"},{"byteCount":90,"contentType":"application/vnd.fuminiwa.entity+json;version=2","entityKey":"attachment/00000000-0000-4000-8000-000000000107/metadata","objectId":"fc6cf4063320fb64649855d0c981ca430812d75f890882be2dda562e864c7779"},{"byteCount":48,"contentType":"application/vnd.fuminiwa.entity+json;version=2","entityKey":"chapter/00000000-0000-4000-8000-000000000101/episode-order","objectId":"ac8f84b04b57e0ac63e128604bd068cc3f632bf3eb53ebdb6397521b9958c7c7"},{"byteCount":21,"contentType":"application/vnd.fuminiwa.entity+json;version=2","entityKey":"chapter/00000000-0000-4000-8000-000000000101/title","objectId":"846de54f526906f43423feabd3cb7cb8564eb8818058f96e59c2981465e4fe20"},{"byteCount":278,"contentType":"application/vnd.fuminiwa.entity+json;version=2","entityKey":"character/00000000-0000-4000-8000-000000000103","objectId":"e3251c7bf97ac4103ac9a66b7875d7c3fce63695b9d28027da6ec7a367a62948"},{"byteCount":27,"contentType":"application/vnd.fuminiwa.entity+json;version=2","entityKey":"episode/00000000-0000-4000-8000-000000000102/body","objectId":"cc10b883d6b9f239651d728f9f655c3667035be36b4e8ef940cc33e4a8cb6eb7"},{"byteCount":18,"contentType":"application/vnd.fuminiwa.entity+json;version=2","entityKey":"episode/00000000-0000-4000-8000-000000000102/memo","objectId":"fb50aa3fc52d407d1d464ec6846d5f63e4d4c597833e81a8432e7c46c953d3e2"},{"byteCount":27,"contentType":"application/vnd.fuminiwa.entity+json;version=2","entityKey":"episode/00000000-0000-4000-8000-000000000102/title","objectId":"089b6c3b12affb9d63ed46fc064476d980f93e9fc15f014f5be0e06e5c6e11b5"},{"byteCount":186,"contentType":"application/vnd.fuminiwa.entity+json;version=2","entityKey":"flag/00000000-0000-4000-8000-000000000105","objectId":"404481ddb31ebcb168f0f506a36dab8cab0fed65a070fffc19620219985ccf4c"},{"byteCount":132,"contentType":"application/vnd.fuminiwa.entity+json;version=2","entityKey":"plot-card/00000000-0000-4000-8000-000000000104","objectId":"6ac3f5aff753e3cfa0b003f572d272c1c566d8b7ff5298929887eafd5c63c4e1"},{"byteCount":48,"contentType":"application/vnd.fuminiwa.entity+json;version=2","entityKey":"work/attachment-order","objectId":"4d9648bcadb7ca74730a311f9592837d3aa2802dd5dcb60b254a5657e92fe90d"},{"byteCount":48,"contentType":"application/vnd.fuminiwa.entity+json;version=2","entityKey":"work/chapter-order","objectId":"1edd25755c907a4b86447d7445a9e4fcf71dacd96f3ea027d955de16f677bdf7"},{"byteCount":48,"contentType":"application/vnd.fuminiwa.entity+json;version=2","entityKey":"work/character-order","objectId":"1b24395c01ecbecef4724726bc4161a1f201dcdc9ad043f1122d1a8ac3643a1c"},{"byteCount":96,"contentType":"application/vnd.fuminiwa.entity+json;version=2","entityKey":"work/document","objectId":"039f44f045ca19936fc13391a6ac6aa51cd3cd6583d259da58e9fd3fa21e5364"},{"byteCount":48,"contentType":"application/vnd.fuminiwa.entity+json;version=2","entityKey":"work/flag-order","objectId":"4e2631bcc7a504d68dde7559e3e89950d9abaf169056df4e664db83df91c84db"},{"byteCount":48,"contentType":"application/vnd.fuminiwa.entity+json;version=2","entityKey":"work/plot-card-order","objectId":"c6865afd00697bcca9dc621fb40ac9051086f7b4d46191ce22340e7fa02215df"},{"byteCount":42,"contentType":"application/vnd.fuminiwa.entity+json;version=2","entityKey":"work/synopsis","objectId":"1b480863422b62bbe354c950dec8f130c2cc85072cb797f391a4806221fdd381"},{"byteCount":27,"contentType":"application/vnd.fuminiwa.entity+json;version=2","entityKey":"work/title","objectId":"16dc45cdbf32d3158bcd5e2c52ddafee992004fd8bdfb5f44900e684896a81f0"},{"byteCount":48,"contentType":"application/vnd.fuminiwa.entity+json;version=2","entityKey":"work/world-note-order","objectId":"4b3a0e2bd8de24e3e0a58d26c40025edca4f60df84f29f77392da2fb75050b90"},{"byteCount":90,"contentType":"application/vnd.fuminiwa.entity+json;version=2","entityKey":"world-note/00000000-0000-4000-8000-000000000106","objectId":"35ac6a5bf3e9f816abd77c0ebb0f6cac1927b7685fdbbd43900e103bcb783898"}],"parentSnapshotIds":[],"schemaVersion":2,"workId":"00000000-0000-4000-8000-000000000202"}